Contents,p_content,old_hastag,Hashtag
"Cho em hỏi nhóm mình có ai dùng colab pro + chưa ạ? Cho em một số review, tiện thể nếu ai có nhu cầu share thì inbox em luôn với.","Cho em hỏi nhóm mình có ai dùng colab pro + chưa ạ? Cho em một số review, tiện thể nếu ai có nhu cầu share thì inbox em luôn với.",,
"Quick tip: Đổi domain từ github.com sang githubtocolab.com là có thể mở được notebook trên github bằng colab luôn nha mọi người 😁
Ví dụ:  https://githubtocolab.com/quan-dang/kubeflow-tutorials/blob/master/1-operators/condition.ipynb",Quick tip: Đổi domain từ github.com sang githubtocolab.com là có thể mở được notebook trên github bằng colab luôn nha mọi người Ví dụ: https://githubtocolab.com/quan-dang/kubeflow-tutorials/blob/master/1-operators/condition.ipynb,,
"🎯 [CG-HN] Tuyển dụng
✅ AI/ML ENGINEER
✅ AI/MLOps
✅ NLP ENGINEER
- Fresher - Senior
- Lương từ 14-45tr
- Đóng BH full lương. Cùng nhiều chế độ VIP
- Công ty logistics top 1 VN. Với rất nhiều dự án khủng cần giải quyết.
- Môi trường, không gian làm việc siêu cấp ...
Inbox mình nha 😃 Many thanks !","[CG-HN] Tuyển dụng AI/ML ENGINEER AI/MLOps NLP ENGINEER - Fresher - Senior - Lương từ 14-45tr - Đóng BH full lương. Cùng nhiều chế độ VIP - Công ty logistics top 1 VN. Với rất nhiều dự án khủng cần giải quyết. - Môi trường, không gian làm việc siêu cấp ... Inbox mình nha Many thanks !",,
"[Cài đặt Kubeflow lên máy tính cá nhân]
Chào mọi người,
Em đang tìm hiểu và cài đặt KubeFlow trên máy local cá nhân. Hiện tại em thấy có nhiều cách triển khai K8s lên máy cá nhân như MicroK8s, minikube. Hiện tại trên máy em đã có microk8s và minikube rồi.
Nhưng em không biết nếu cài đặt KubeFlow lên minikube trong máy tính cá nhân thì mình cài đặt như thế nào. Em có thấy một số tutorial hướng dẫn cách này nhưng từ version v0.x rồi, mà trên trang chính thức của Kubeflow bản hiện tại thì không còn hướng dẫn cài đặt KF trên minikube nữa.
Em muốn hỏi mọi thường thường cài KF lên máy cá nhân thì sẽ cài như thế nào ạ ? Em cảm ơn mọi người.
-----------------
Update: Cảm ơn bác Quan Dang
Em làm theo cách này thì cài MiniKF dễ dàng hơn:
https://v1-0-branch.kubeflow.org/docs/started/workstation/getting-started-minikf/
#MLOps #Kubeflow #caidat #hoidap","[Cài đặt Kubeflow lên máy tính cá nhân] Chào mọi người, Em đang tìm hiểu và cài đặt KubeFlow trên máy local cá nhân. Hiện tại em thấy có nhiều cách triển khai K8s lên máy cá nhân như MicroK8s, minikube. Hiện tại trên máy em đã có microk8s và minikube rồi. Nhưng em không biết nếu cài đặt KubeFlow lên minikube trong máy tính cá nhân thì mình cài đặt như thế nào. Em có thấy một số tutorial hướng dẫn cách này nhưng từ version v0.x rồi, mà trên trang chính thức của Kubeflow bản hiện tại thì không còn hướng dẫn cài đặt KF trên minikube nữa. Em muốn hỏi mọi thường thường cài KF lên máy cá nhân thì sẽ cài như thế nào ạ ? Em cảm ơn mọi người. ----------------- Update: Cảm ơn bác Quan Dang Em làm theo cách này thì cài MiniKF dễ dàng hơn: https://v1-0-branch.kubeflow.org/docs/started/workstation/getting-started-minikf/",#MLOps	#Kubeflow	#caidat	#hoidap,
"💡 How to grow as an AI Engineer? 💡
by Nguyễn Văn Tâm, AI Engineer @ Instill AI
https://www.facebook.com/instilltech/posts/565849418605636","How to grow as an AI Engineer? by Nguyễn Văn Tâm, AI Engineer @ Instill AI https://www.facebook.com/instilltech/posts/565849418605636",,
"Mọi người ơi cho em hỏi về kinh nghiệm thiết kế với ạ.
Trường hợp em có khoảng 100 models cần online, language model, tương đối lớn. Vậy thì nên:
1. Sử dụng serverless, ví dụ như aws thì nhiều lambda function
Hay là
2. Sử dụng container orchestration như k8s, như vậy cost sẽ nhiều hơn.
Em cảm ơn","Mọi người ơi cho em hỏi về kinh nghiệm thiết kế với ạ. Trường hợp em có khoảng 100 models cần online, language model, tương đối lớn. Vậy thì nên: 1. Sử dụng serverless, ví dụ như aws thì nhiều lambda function Hay là 2. Sử dụng container orchestration như k8s, như vậy cost sẽ nhiều hơn. Em cảm ơn",,
"[MLOps & ML-Engineers positions] Aimino: Creating Intelligence with Synthetic data
Gartner predicts that 60% of data being used will be synthetically generated by 2024.  By 2030, “fake data” might entirely replace real data. Synthetic data are essential when historical data become obsolete, or when real-world data collection is dangerous or difficult.
Aimino is the provider to bring Machine Learning into real applications easily with synthetic data.
Join us on this exciting journey! Feel free to reach out to our university team at hieu.cao@aimino.de or to me at tam.nguyen@aimino.de
More at: https://aimino.de/career/","[MLOps & ML-Engineers positions] Aimino: Creating Intelligence with Synthetic data Gartner predicts that 60% of data being used will be synthetically generated by 2024. By 2030, “fake data” might entirely replace real data. Synthetic data are essential when historical data become obsolete, or when real-world data collection is dangerous or difficult. Aimino is the provider to bring Machine Learning into real applications easily with synthetic data. Join us on this exciting journey! Feel free to reach out to our university team at hieu.cao@aimino.de or to me at tam.nguyen@aimino.de More at: https://aimino.de/career/",,
"Continuous training with XGboost, LightGBM and CatBoost","Continuous training with XGboost, LightGBM and CatBoost",,
"Serverless Optimization Workshop (Performance and Cost)
During this workshop you will learn some best practice technique to optimize your serverless workloads to reduce costs and improve performance. The workshop focuses on AWS Lambda however other services are used throughout including: Amazon SQS, Amazon API Gateway, Amazon DynamoDB, AWS Step Functions, AWS AppConfig
https://catalog.us-east-1.prod.workshops.aws/workshops/2d960419-7d15-44e7-b540-fd3ebeb7ce2e/en-US","Serverless Optimization Workshop (Performance and Cost) During this workshop you will learn some best practice technique to optimize your serverless workloads to reduce costs and improve performance. The workshop focuses on AWS Lambda however other services are used throughout including: Amazon SQS, Amazon API Gateway, Amazon DynamoDB, AWS Step Functions, AWS AppConfig https://catalog.us-east-1.prod.workshops.aws/workshops/2d960419-7d15-44e7-b540-fd3ebeb7ce2e/en-US",,
Một phương pháp để estimate AUC-ROC khi chưa có ground truth,Một phương pháp để estimate AUC-ROC khi chưa có ground truth,,
"Các bước để ship model lên production bởi team DoorDash Anti-Fraud DSML

Bước 0: Pre-production iterations
Train, evaluate và tune model ở môi trường development
Bước 1: Production: shadow traffic, 1% volume
Đưa model lên production với 1% shadow traffic (traffic được copy từ live traffic). Bước này nhằm sẽ đảm bảo hệ thống chạy trơn tru từ đầu đến cuối ở production.
Bước 2: Production: shadow traffic, 100% volume
Tăng traffic vào model mới lên 100% để phân tích sự ảnh hưởng của model tới business, đồng thời đảm bảo các system metrics (CPU, memory, latency, ...) không có vấn đề gì quá nghiêm trọng.
Bước 3: Experiment that compares the performance of the incumbent and new models
So sánh 2 models với nhau để xem model mới có thực sự tốt hơn ở môi trường production không, nếu có thì sẽ promote model mới này lên thay thế model incumbent.
https://doordash.engineering/2022/03/08/ship-to-production-darkly-moving-fast-staying-safe-with-ml-deployments/","Các bước để ship model lên production bởi team DoorDash Anti-Fraud DSML Bước 0: Pre-production iterations Train, evaluate và tune model ở môi trường development Bước 1: Production: shadow traffic, 1% volume Đưa model lên production với 1% shadow traffic (traffic được copy từ live traffic). Bước này nhằm sẽ đảm bảo hệ thống chạy trơn tru từ đầu đến cuối ở production. Bước 2: Production: shadow traffic, 100% volume Tăng traffic vào model mới lên 100% để phân tích sự ảnh hưởng của model tới business, đồng thời đảm bảo các system metrics (CPU, memory, latency, ...) không có vấn đề gì quá nghiêm trọng. Bước 3: Experiment that compares the performance of the incumbent and new models So sánh 2 models với nhau để xem model mới có thực sự tốt hơn ở môi trường production không, nếu có thì sẽ promote model mới này lên thay thế model incumbent. https://doordash.engineering/2022/03/08/ship-to-production-darkly-moving-fast-staying-safe-with-ml-deployments/",,
"Hello cả nhà 👨‍👩‍👦‍👦, theo yêu cầu của một số bác thì hôm nay em xin liều mạng đóng góp thêm một bài viết nho nhỏ về cách serve model sử dụng FastAPI và Kubernetes (k8s).
Chúc cả nhà một buổi tối vui vẻ 🥰","Hello cả nhà , theo yêu cầu của một số bác thì hôm nay em xin liều mạng đóng góp thêm một bài viết nho nhỏ về cách serve model sử dụng FastAPI và Kubernetes (k8s). Chúc cả nhà một buổi tối vui vẻ",,
mình tìm đồng đội ở HCMC 🥹,mình tìm đồng đội ở HCMC,,
"ML Infrastructure Interview - Part 3
Hi cả nhà, mình lại quay trở lại với series Machine Learning Infrastructure Interview đây.
Hôm nay mình viết bài này với 1 mục đích thôi. Đó là để thông báo với mọi người rằng mình vừa viết xong 2 bài mới, và cũng là 2 bài cuối cùng trong series Machine Learning Infrastructure Interview. 2 bài này nói về:
Machine Learning Infrastructure Learning Resources: https://aiengineer.net/ml-skills/machine-learning-infrastructure-interview/learning-resources
Machine Learning Infrastructure Interview Questions: https://aiengineer.net/ml-skills/machine-learning-infrastructure-interview/interview-questions
Okay vậy thôi, mong mọi người enjoy bộ câu hỏi interview có 1 0 2 này. Hẹn gặp mọi người trong các series khác. Tạm biệt và gud nike!","ML Infrastructure Interview - Part 3 Hi cả nhà, mình lại quay trở lại với series Machine Learning Infrastructure Interview đây. Hôm nay mình viết bài này với 1 mục đích thôi. Đó là để thông báo với mọi người rằng mình vừa viết xong 2 bài mới, và cũng là 2 bài cuối cùng trong series Machine Learning Infrastructure Interview. 2 bài này nói về: Machine Learning Infrastructure Learning Resources: https://aiengineer.net/ml-skills/machine-learning-infrastructure-interview/learning-resources Machine Learning Infrastructure Interview Questions: https://aiengineer.net/ml-skills/machine-learning-infrastructure-interview/interview-questions Okay vậy thôi, mong mọi người enjoy bộ câu hỏi interview có 1 0 2 này. Hẹn gặp mọi người trong các series khác. Tạm biệt và gud nike!",,
"Hi cả nhà,
Em/mình xin phép dùng clone vì trong group có người quen 🙂
Em/mình đã có 02 năm kinh nghiệm ở vị trí data scientist/analyst, giờ muốn dịch chuyển dần sang MLE thì cần chuẩn bị những gì ạ? và có cty nào ở HN (hoặc HCM, em sẵn sàng relocate) đang tìm fresher/junior MLE ko ạ? vì hình như role này ko tuyển đại trà, em chỉ thấy các cty tuyển senior MLE là chủ yếu.
Cảm ơn cả nhà nhiều. Nhờ admin duyệt giúp ạ 😀","Hi cả nhà, Em/mình xin phép dùng clone vì trong group có người quen Em/mình đã có 02 năm kinh nghiệm ở vị trí data scientist/analyst, giờ muốn dịch chuyển dần sang MLE thì cần chuẩn bị những gì ạ? và có cty nào ở HN (hoặc HCM, em sẵn sàng relocate) đang tìm fresher/junior MLE ko ạ? vì hình như role này ko tuyển đại trà, em chỉ thấy các cty tuyển senior MLE là chủ yếu. Cảm ơn cả nhà nhiều. Nhờ admin duyệt giúp ạ",,
"ML Infrastructure Interview - Part 2
Hi cả nhà, hôm nay mình viết bài này với 2 mục đích.
Mục đích thứ nhất là để cảm ơn mọi người. Sau bài đăng trong group mình tuần trước, mình đã nhận được nhiều sự quan tâm và ủng hộ từ mọi người, các tin nhắn từ các bạn có nhu cầu trao đổi trực tiếp và các chuyên gia trong ngành cần bàn luận về các vấn đề trong Machine Learning System. Cảm ơn mọi người lần nữa vì đã giúp mình có cơ hội được nói chuyện và chia sẻ.
Mục đích thứ hai là để thông báo với mọi người rằng mình vừa viết xong 2 bài tiếp theo trong loạt bài về Machine Learning Infrastructure Interview. 2 bài mới này nói về:
Machine Learning Infrastructure Roadmap: https://aiengineer.net/ml-skills/machine-learning-infrastructure-interview/the-roadmap
Machine Learning Infrastructure Interview Process: https://aiengineer.net/ml-skills/machine-learning-infrastructure-interview/interview-process
Hy vọng tiếp tục nhận được sự ủng hộ và nhiều tin nhắn nữa từ mọi người.
LinkedIn: https://www.linkedin.com/in/tungdao17/","ML Infrastructure Interview - Part 2 Hi cả nhà, hôm nay mình viết bài này với 2 mục đích. Mục đích thứ nhất là để cảm ơn mọi người. Sau bài đăng trong group mình tuần trước, mình đã nhận được nhiều sự quan tâm và ủng hộ từ mọi người, các tin nhắn từ các bạn có nhu cầu trao đổi trực tiếp và các chuyên gia trong ngành cần bàn luận về các vấn đề trong Machine Learning System. Cảm ơn mọi người lần nữa vì đã giúp mình có cơ hội được nói chuyện và chia sẻ. Mục đích thứ hai là để thông báo với mọi người rằng mình vừa viết xong 2 bài tiếp theo trong loạt bài về Machine Learning Infrastructure Interview. 2 bài mới này nói về: Machine Learning Infrastructure Roadmap: https://aiengineer.net/ml-skills/machine-learning-infrastructure-interview/the-roadmap Machine Learning Infrastructure Interview Process: https://aiengineer.net/ml-skills/machine-learning-infrastructure-interview/interview-process Hy vọng tiếp tục nhận được sự ủng hộ và nhiều tin nhắn nữa từ mọi người. LinkedIn: https://www.linkedin.com/in/tungdao17/",,
"https://github.com/DataTalksClub/mlops-zoomcamp
Một khóa học MLOps khá hay và chi tiết đến từ DataTalksClub, mỗi tội tác giả mới update 2 module đầu 🤣","https://github.com/DataTalksClub/mlops-zoomcamp Một khóa học MLOps khá hay và chi tiết đến từ DataTalksClub, mỗi tội tác giả mới update 2 module đầu",,
Đôi khi 1 quyển sách đủ để làm thay đổi cuộc đời bạn. Đằng này những 6 cuốn. :D,Đôi khi 1 quyển sách đủ để làm thay đổi cuộc đời bạn. Đằng này những 6 cuốn. :D,,
FYI,FYI,,
Xin giới thiệu các bạn quan tâm đến việc phỏng vấn về Machine Learning ở các công ty FAANG. https://rebrand.ly/mldesignbook Bạn có thể đọc sample ở đây: https://rebrand.ly/MachineLearningDesignShort,Xin giới thiệu các bạn quan tâm đến việc phỏng vấn về Machine Learning ở các công ty FAANG. https://rebrand.ly/mldesignbook Bạn có thể đọc sample ở đây: https://rebrand.ly/MachineLearningDesignShort,,
"Chào mọi người ạ, em mới tìm hiểu về kubeflow. Hiện em đã cài đặt kubeflow thông qua microk8s và juju trên 1 máy cá nhân ko có GPU. Hiện em đang muốn add thêm 1 node từ 1 máy khác có GPU vào cluster chứa Kubeflow để dùng GPU train model cho nhanh hơn. Mọi người đã có ai làm trường hợp tương tự chưa ạ, có thể gợi ý cho em cần những gì ko ạ","Chào mọi người ạ, em mới tìm hiểu về kubeflow. Hiện em đã cài đặt kubeflow thông qua microk8s và juju trên 1 máy cá nhân ko có GPU. Hiện em đang muốn add thêm 1 node từ 1 máy khác có GPU vào cluster chứa Kubeflow để dùng GPU train model cho nhanh hơn. Mọi người đã có ai làm trường hợp tương tự chưa ạ, có thể gợi ý cho em cần những gì ko ạ",,
FYI!,FYI!,,
"#MoMo #Hanoi #HoChiMinh
✌️Em chào các anh chị, công ty M nhà em (cụ thể là M_service) rất tha thiết tuyển các vị trí: MLOPs, Machine Learning Engineer, Data Engineer, AI Software Engineer. Các vị trí open với các bạn từ 2 năm kinh nghiệm trở lên ạ.
✌️Sơ qua thông tin về môi trường:
+ Môi trường thoải mái tự do: nhân viên mặc gì thì mặc đừng mặc kệ job; không chấm công giờ làm việc, làm từ thứ 2-6. Hôm nào muốn làm việc ở nhà thì alo xin sếp, miễn đảm bảo chất lượng và kết quả công việc là được ạ;
+ Sếp, đồng nghiệp nice, team thực sự rất vui ạ. Nhân sự là key member từ Pique, background sáng, công ty startup đã sát nhập vào MoMo;
+ Văn phòng ở 444 Hoàng Hoa Thám, nếu mình có duyên thì chỗ ngồi view Hồ Tây ạ =)) chiều chiều đi làm xong lượn 1 vòng Hồ Tây về cũng khá là chill ạ;
+ Phỏng vấn online/ offline như nào cũng được, miễn là tiện cho các anh chị em, 2 vòng;
-> JD em để dưới comment ạ. Em mong nhận được sự quan tâm của mọi người.
Em cũng cảm ơn admin đã duyệt bài ạ.","Em chào các anh chị, công ty M nhà em (cụ thể là M_service) rất tha thiết tuyển các vị trí: MLOPs, Machine Learning Engineer, Data Engineer, AI Software Engineer. Các vị trí open với các bạn từ 2 năm kinh nghiệm trở lên ạ. Sơ qua thông tin về môi trường: + Môi trường thoải mái tự do: nhân viên mặc gì thì mặc đừng mặc kệ job; không chấm công giờ làm việc, làm từ thứ 2-6. Hôm nào muốn làm việc ở nhà thì alo xin sếp, miễn đảm bảo chất lượng và kết quả công việc là được ạ; + Sếp, đồng nghiệp nice, team thực sự rất vui ạ. Nhân sự là key member từ Pique, background sáng, công ty startup đã sát nhập vào MoMo; + Văn phòng ở 444 Hoàng Hoa Thám, nếu mình có duyên thì chỗ ngồi view Hồ Tây ạ =)) chiều chiều đi làm xong lượn 1 vòng Hồ Tây về cũng khá là chill ạ; + Phỏng vấn online/ offline như nào cũng được, miễn là tiện cho các anh chị em, 2 vòng; -> JD em để dưới comment ạ. Em mong nhận được sự quan tâm của mọi người. Em cũng cảm ơn admin đã duyệt bài ạ.",#MoMo	#Hanoi	#HoChiMinh,
"High-level architecture của một hệ thống Recommendation trong thực tế
Part 1: https://blog.fennel.ai/p/real-world-recommendation-system?s=w
Part 2: https://blog.fennel.ai/p/real-world-recommendation-systems?s=r",High-level architecture của một hệ thống Recommendation trong thực tế Part 1: https://blog.fennel.ai/p/real-world-recommendation-system?s=w Part 2: https://blog.fennel.ai/p/real-world-recommendation-systems?s=r,,
"Helm (https://helm.sh/) là một công cụ giúp quản lý các ứng dụng (ví dụ: install, upgrade, rollback, và uninstall, ...) trên nền tảng k8s. Mình xin chia sẻ một số kiến thức và kinh nghiệm khi làm việc với tool này, với ví dụ cụ thể là deploy MLFlow lên Kubeflow platform. Chúc cả nhà cuối tuần vui vẻ :D.","Helm (https://helm.sh/) là một công cụ giúp quản lý các ứng dụng (ví dụ: install, upgrade, rollback, và uninstall, ...) trên nền tảng k8s. Mình xin chia sẻ một số kiến thức và kinh nghiệm khi làm việc với tool này, với ví dụ cụ thể là deploy MLFlow lên Kubeflow platform. Chúc cả nhà cuối tuần vui vẻ :D.",,
"Chào m.n, Em đang gặp một số vấn đề cần sự giúp đỡ khi triển khai ứng dụng deep cho đồ án tốt nghiệp, sử dụng cloud AWS.
Mô tả: khi sử dụng Flask với phương thức get ( hình 1) cần qua 2 model GAN (65MB, 320MB) để có được output , em đã triển khai ở máy local sử dụng ngrok làm server và time client post image tới khi server trả output ~ 7s.
Tuy nhiên khi triển khai do sử dụng ec2 intance type t2.micro free nên chỉ có 1vCPU ,   khi nhận request thì server bị out CPU (quá tải) ( hình 2) và time lên đến 30s - 40s / 1 request. 
Em có thử AutoScalling , loadBlancers , do lần đầu sử dụng không biết đã khởi tạo đúng chưa.
Câu hỏi 1: do mô hình nặng nên cần phải sử dụng instance type có tính phí ( vd: t2.xlarge 4vCPU, .. )  không
2.  AutoScaling,loadBlancers tới main instance chạy port 8000 như thế nào mới chính xác ? 
Em cảm ơn.","Chào m.n, Em đang gặp một số vấn đề cần sự giúp đỡ khi triển khai ứng dụng deep cho đồ án tốt nghiệp, sử dụng cloud AWS. Mô tả: khi sử dụng Flask với phương thức get ( hình 1) cần qua 2 model GAN (65MB, 320MB) để có được output , em đã triển khai ở máy local sử dụng ngrok làm server và time client post image tới khi server trả output ~ 7s. Tuy nhiên khi triển khai do sử dụng ec2 intance type t2.micro free nên chỉ có 1vCPU , khi nhận request thì server bị out CPU (quá tải) ( hình 2) và time lên đến 30s - 40s / 1 request. Em có thử AutoScalling , loadBlancers , do lần đầu sử dụng không biết đã khởi tạo đúng chưa. Câu hỏi 1: do mô hình nặng nên cần phải sử dụng instance type có tính phí ( vd: t2.xlarge 4vCPU, .. ) không 2. AutoScaling,loadBlancers tới main instance chạy port 8000 như thế nào mới chính xác ? Em cảm ơn.",,
"Skillset của Site Reliability Engineers (SREs) đóng một vai trò quan trọng trong quá trình thiết kế và triển khai các hệ thống ML, hy vọng tài liệu của LinkedIn sẽ có ích với mọi người.
https://linkedin.github.io/school-of-sre/","Skillset của Site Reliability Engineers (SREs) đóng một vai trò quan trọng trong quá trình thiết kế và triển khai các hệ thống ML, hy vọng tài liệu của LinkedIn sẽ có ích với mọi người. https://linkedin.github.io/school-of-sre/",,
"Sau rất nhiều ngày tháng chầy bửa, em xin được ra mắt phần 2 cho series Seldon Core, nói về autoscale, metrics, và health checks, các bác cứ ném đá mạnh tay nha =))) Chúc cả nhà cuối tuần vui vẻ 🥳","Sau rất nhiều ngày tháng chầy bửa, em xin được ra mắt phần 2 cho series Seldon Core, nói về autoscale, metrics, và health checks, các bác cứ ném đá mạnh tay nha =))) Chúc cả nhà cuối tuần vui vẻ",,
,nan,,
